{
  "baseline_commit": "00e60d7a45ca4b395f299735afbe06d2117a8124",
  "canonical": false,
  "derived": true,
  "entries": [
    {
      "authority": "governance",
      "content_hash": "b230408b5469537d540117825c4085ad2b5d69f3aa17e82dadf46f8c8fa3d0b8",
      "default_search": true,
      "entry_hash": "fa36c64be043a3fcf6ece5126b9393c0090cfaeebd9b6105020577b877879f93",
      "index_state": "current",
      "links": [],
      "path": ".agents/decisions/2026-09-05-change-curriculum-architecture-workflow.md",
      "source_status": "unknown",
      "title": "Đặc tả quy trình thay đổi kiến trúc giáo trình",
      "type": "governance-decision"
    },
    {
      "authority": "governance",
      "content_hash": "49eb274b1d051a2ae173cc5a1fbd9a0b50a2b6021e836351250ff7abcea7c090",
      "default_search": true,
      "entry_hash": "d93adb2edfd7ca9a4c86fc319b6b8ba23253d6ac80afa489e982145347de5c41",
      "index_state": "current",
      "links": [],
      "path": ".agents/decisions/2026-09-05-goal-lesson-workflow-hardening.md",
      "source_status": "unknown",
      "title": "Làm rõ quyền sở hữu và đường chuyển cấp trong quy trình hoàn thiện bài học",
      "type": "governance-decision"
    },
    {
      "authority": "governance",
      "content_hash": "8d4b51daa50450e3fdbcd4ac7ef7bef033eff9d05d61394029c0179dac3388c0",
      "default_search": true,
      "entry_hash": "9ae71163180273b4469fdb93a7dfb3b10f1a4a4cf44cf8cdf5282bbb396dc6c0",
      "index_state": "current",
      "links": [],
      "path": ".agents/decisions/2026-09-05-governance-hardening.md",
      "source_status": "unknown",
      "title": "Làm rõ quản trị, nghiệm thu và cơ chế điều phối tác nhân AI",
      "type": "governance-decision"
    },
    {
      "authority": "governance",
      "content_hash": "c96ac8b4b88b8874a136ba5d4a86b864b6c793bddbf7588c54417c3de6aeb397",
      "default_search": true,
      "entry_hash": "9922afd567a1a1ce681168fb84ea3559b0e4574f35275c62bc70bf6c4d865f4f",
      "index_state": "current",
      "links": [],
      "path": ".agents/decisions/2026-09-05-language-and-notation.md",
      "source_status": "unknown",
      "title": "Chuẩn hóa ngôn ngữ và ký hiệu kỹ thuật",
      "type": "governance-decision"
    },
    {
      "authority": "governance",
      "content_hash": "bd1de67484bb97eb2299cdd88af9bd8ad58cd39031c88de05004ebd24550b0f4",
      "default_search": true,
      "entry_hash": "7d15950490ebf2649d0f5d0dc470f5026d1c4742cd6ed31f9e751a945208d514",
      "index_state": "current",
      "links": [],
      "path": ".agents/decisions/2026-09-05-workflow-agent-orchestration.md",
      "source_status": "unknown",
      "title": "Xác định quan hệ giữa vai trò và tác nhân trong quy trình",
      "type": "governance-decision"
    },
    {
      "authority": "governance",
      "content_hash": "7089c11eb4314a2740facc374dbaa8f3e82768ebd576268922df739fe6dc92f9",
      "default_search": true,
      "entry_hash": "7f7bdf34cd79df7390bf48e26610de44cefd4fd3beeadd7c1c676f78778bf0b5",
      "index_state": "current",
      "links": [],
      "path": ".agents/decisions/2026-09-06-compose-learning-run-workflow.md",
      "source_status": "unknown",
      "title": "Thiết kế quy trình ghép lộ trình học",
      "type": "governance-decision"
    },
    {
      "authority": "governance",
      "content_hash": "130d905c3a432bf7c217fe4311d602118ce37af60abafad8a32cc0c88358f9f0",
      "default_search": true,
      "entry_hash": "22b41660438347797d80638c6f08171587be58062663d43eb76e87215ccf9cd2",
      "index_state": "current",
      "links": [],
      "path": ".agents/decisions/2026-09-06-pilot-and-validate-workflow.md",
      "source_status": "unknown",
      "title": "Thiết kế quy trình dạy thử và kiểm chứng",
      "type": "governance-decision"
    },
    {
      "authority": "governance",
      "content_hash": "21c524d04552ac9f8c103286b30e15efbad451d8a2b1704c3a44e5e700cea24c",
      "default_search": true,
      "entry_hash": "666dc1fca6048c8ba8d40be012fb88b37f4a977ca5877a890dc451bbe5c31cc7",
      "index_state": "current",
      "links": [],
      "path": ".agents/decisions/2026-09-06-refresh-volatile-content-workflow.md",
      "source_status": "unknown",
      "title": "Thiết kế quy trình làm mới nội dung dễ lỗi thời",
      "type": "governance-decision"
    },
    {
      "authority": "governance",
      "content_hash": "dc718b7a134bb7a7c81b1c3cd48e3700880e51f8b5f56e77aa17fcd94f5a8b4c",
      "default_search": true,
      "entry_hash": "b4c3e2f8b151006c7678188a23ec2318cc08c7e1b2a67a88ecd3ce114f2250d2",
      "index_state": "current",
      "links": [],
      "path": ".agents/decisions/2026-09-12-agent-harness-optimization-workflow.md",
      "source_status": "unknown",
      "title": "Thêm khung quy trình tối ưu hệ thống harness tác nhân",
      "type": "governance-decision"
    },
    {
      "authority": "governance",
      "content_hash": "f5f857c0b04f4fd4004fa15c7afdcedd5e4e3c9167e1acbf9451c6654cbe14de",
      "default_search": true,
      "entry_hash": "3ad17fc9fac8e7d409167c51696e2a3ec2b2e53b569d51b4fe88816389ce8a29",
      "index_state": "current",
      "links": [],
      "path": ".agents/decisions/2026-09-12-g04-g08-g09-context-boundary-trial.md",
      "source_status": "unknown",
      "title": "Chạy thử phân bổ lại năng lực quản lý tri thức giữa G04, G08 và G09",
      "type": "governance-decision"
    },
    {
      "authority": "governance",
      "content_hash": "0cc8e3e7a5a12513368cf119499074a9ea75c11b486141d52a8af2ddc53bedfd",
      "default_search": true,
      "entry_hash": "c8b051cf11525c5c09df05853253e73e9a5b7e3f3fb256062a81e36516cb98ab",
      "index_state": "current",
      "links": [],
      "path": ".agents/decisions/2026-09-12-goal-external-research-gate.md",
      "source_status": "unknown",
      "title": "Đặt cổng khảo sát nguồn bên ngoài trước khi soạn bài học",
      "type": "governance-decision"
    },
    {
      "authority": "governance",
      "content_hash": "52ad4698ea9228f4a6c5edbcd4a35e08cb9a6c7002f998786118a6020b0b17c0",
      "default_search": true,
      "entry_hash": "4827d63a1ac619de43186d71a195efe747091d4a66700c7d8bf17d8a2e2b6ed9",
      "index_state": "current",
      "links": [],
      "path": ".agents/decisions/2026-09-12-reopen-goal-lesson-external-research.md",
      "source_status": "unknown",
      "title": "Mở lại quy trình hoàn thiện bài học để thiết kế nghiên cứu nguồn bên ngoài",
      "type": "governance-decision"
    },
    {
      "authority": "governance",
      "content_hash": "b1dd81a8629a46c256b486d6345555dc6bd50549ca48b62530554b6cf2f0e6c9",
      "default_search": true,
      "entry_hash": "b876627fd9bce2ea8374a16c82f84e231420f37ff25929bfa1b264b01b31d4e1",
      "index_state": "current",
      "links": [],
      "path": ".agents/decisions/2026-09-15-agent-harness-workflow-proposed.md",
      "source_status": "unknown",
      "title": "Hoàn thiện quy trình tối ưu hệ thống harness tác nhân",
      "type": "governance-decision"
    },
    {
      "authority": "governance",
      "content_hash": "c3742bfbec97c36ecf611ee7510d69f1a5e8ca6db3de51ec568d5369bb1f6a9b",
      "default_search": true,
      "entry_hash": "a97242fd6186c5139b8709d621aad70b1b4b815a91b0ad17e2c4b394d6e9c4b3",
      "index_state": "current",
      "links": [],
      "path": ".agents/decisions/2026-09-16-optimize-agent-harness-first-pilot-ratified.md",
      "source_status": "unknown",
      "title": "Ratification of the optimize-agent-harness first pilot",
      "type": "governance-decision"
    },
    {
      "authority": "governance",
      "content_hash": "ead98a886d894a73722f5a787388108f039a892fc9ea5a1da7d4672f2bc1bdc8",
      "default_search": true,
      "entry_hash": "f5de265c8de8f94db252aaf6de484dc4962ae651571363cfac9dcda0fa779d97",
      "index_state": "current",
      "links": [],
      "path": ".agents/decisions/README.md",
      "source_status": "unknown",
      "title": "Hồ sơ quyết định quản trị giáo trình",
      "type": "governance-decision"
    },
    {
      "authority": "operational",
      "content_hash": "3c774052cd01c8c88dabe667554a1aaa52a33bf75f5effdfcb414cbda7831454",
      "default_search": true,
      "entry_hash": "512d8ffa2a2af984c9a3e3d37b0c866a74f357deac415e66ca64c7a4baa1c3cd",
      "index_state": "current",
      "links": [],
      "path": ".agents/indexing/README.md",
      "source_status": "experimental",
      "title": "Derived context index tools",
      "type": "indexing-tool"
    },
    {
      "authority": "operational",
      "content_hash": "2a188a5e7f87795af83742772faf9f4f3f3072cae7a377d8939a0eef131b2ecd",
      "default_search": true,
      "entry_hash": "0c9a6f08f166a60a0493f696a1411b2ce00cd49f9eeff50c9ba9539ee0c34917",
      "index_state": "current",
      "links": [],
      "path": ".agents/indexing/benchmark_index.py",
      "source_status": "experimental",
      "title": "benchmark_index",
      "type": "indexing-tool"
    },
    {
      "authority": "operational",
      "content_hash": "3d7d593131b7104860ef805b93fdc8b0864b736690b2336990dddd624c213100",
      "default_search": true,
      "entry_hash": "07d5c03ad4fb6e123ac9a7c7a937be0760b4c4ed53c55764f7f8b609d9d295e7",
      "index_state": "current",
      "links": [],
      "path": ".agents/indexing/build_context_package.py",
      "source_status": "experimental",
      "title": "build_context_package",
      "type": "indexing-tool"
    },
    {
      "authority": "operational",
      "content_hash": "15d99ccd00b20f57903457ab830cd77b78e08df17e5579063ba76f178ed790b4",
      "default_search": true,
      "entry_hash": "7165300cdfd6fbe5dc00f5b10b43dea9762dd5d24f069f2de7879054248b340d",
      "index_state": "current",
      "links": [],
      "path": ".agents/indexing/index-config.json",
      "source_status": "experimental",
      "title": "index-config",
      "type": "indexing-tool"
    },
    {
      "authority": "operational",
      "content_hash": "11c88e04cc70fc13e67e78247198df79a0fec4aa547e989f8d1a5035259766ac",